<?xml version="1.0" encoding="UTF-8"?>

<!ELEMENT Armors (head, chest, legs, arms)>

<!ELEMENT head (light, medium, heavy)>
<!ELEMENT chest (light, medium, heavy)>
<!ELEMENT legs (light, medium, heavy)>
<!ELEMENT arms (light, medium, heavy)>

<!ELEMENT light (armor)+>
<!ELEMENT medium (armor)+>
<!ELEMENT heavy (armor)+>

<!ELEMENT armor (name, image, defense, speed)>

<!ELEMENT name (#PCDATA)>
<!ELEMENT image (full, tile)>
<!ELEMENT defense (#PCDATA)>
<!ELEMENT speed (#PCDATA)>

<!ELEMENT full (#PCDATA)>
<!ELEMENT tile (#PCDATA)>
